{
  "schema_version": 2,
  "title": "Azahar 六帧领域模型适配",
  "time_domain": "trace_cpu_ns",
  "gpu_cpu_alignment": "not-applicable",
  "window": {
    "start_ns": 0,
    "end_ns": 60000000
  },
  "frame_markers": [
    {
      "frame": 900,
      "time_ns": 0,
      "boundary": "end"
    },
    {
      "frame": 901,
      "time_ns": 10000000,
      "boundary": "end"
    },
    {
      "frame": 902,
      "time_ns": 20000000,
      "boundary": "end"
    },
    {
      "frame": 903,
      "time_ns": 30000000,
      "boundary": "end"
    },
    {
      "frame": 904,
      "time_ns": 40000000,
      "boundary": "end"
    },
    {
      "frame": 905,
      "time_ns": 50000000,
      "boundary": "end"
    },
    {
      "frame": 906,
      "time_ns": 60000000,
      "boundary": "end"
    }
  ],
  "stage_options": {
    "Guest": {
      "order": 0,
      "role": "root",
      "raw_sum_label": "core-ms"
    },
    "PICA": {
      "order": 1,
      "role": "root",
      "source_role_layout": "color"
    },
    "Host Record": {
      "order": 2,
      "role": "root"
    },
    "FSR": {
      "order": 3,
      "role": "detail",
      "parent": "Host Record",
      "layout": "inline",
      "count_for_concurrency": false
    }
  },
  "intervals": [
    {
      "stage": "Guest",
      "lane": "EmuCore0",
      "start_ns": 0,
      "end_ns": 6000000,
      "token": "10",
      "source": "synthetic fixture",
      "source_role": "unknown"
    },
    {
      "stage": "Guest",
      "lane": "EmuCore1",
      "start_ns": 1000000,
      "end_ns": 5000000,
      "token": "10",
      "source": "synthetic fixture",
      "source_role": "unknown"
    },
    {
      "stage": "PICA",
      "lane": "PicaWorker",
      "start_ns": 3000000,
      "end_ns": 7000000,
      "token": "10",
      "source": "synthetic fixture",
      "source_role": "source_candidate"
    },
    {
      "stage": "Host Record",
      "lane": "RecordWorker",
      "start_ns": 7000000,
      "end_ns": 9000000,
      "token": "10",
      "source": "synthetic fixture",
      "source_role": "unknown"
    },
    {
      "stage": "FSR",
      "lane": "RecordWorker",
      "start_ns": 7300000,
      "end_ns": 8000000,
      "token": "10",
      "source": "synthetic fixture",
      "source_role": "unknown"
    },
    {
      "stage": "Guest",
      "lane": "EmuCore0",
      "start_ns": 10000000,
      "end_ns": 16000000,
      "token": "11",
      "source": "synthetic fixture",
      "source_role": "unknown"
    },
    {
      "stage": "Guest",
      "lane": "EmuCore1",
      "start_ns": 11000000,
      "end_ns": 15000000,
      "token": "11",
      "source": "synthetic fixture",
      "source_role": "unknown"
    },
    {
      "stage": "PICA",
      "lane": "PicaWorker",
      "start_ns": 13000000,
      "end_ns": 17000000,
      "token": "11",
      "source": "synthetic fixture",
      "source_role": "source_candidate"
    },
    {
      "stage": "Host Record",
      "lane": "RecordWorker",
      "start_ns": 17000000,
      "end_ns": 19000000,
      "token": "11",
      "source": "synthetic fixture",
      "source_role": "unknown"
    },
    {
      "stage": "FSR",
      "lane": "RecordWorker",
      "start_ns": 17300000,
      "end_ns": 18000000,
      "token": "11",
      "source": "synthetic fixture",
      "source_role": "unknown"
    },
    {
      "stage": "Guest",
      "lane": "EmuCore0",
      "start_ns": 20000000,
      "end_ns": 26000000,
      "token": "12",
      "source": "synthetic fixture",
      "source_role": "unknown"
    },
    {
      "stage": "Guest",
      "lane": "EmuCore1",
      "start_ns": 21000000,
      "end_ns": 25000000,
      "token": "12",
      "source": "synthetic fixture",
      "source_role": "unknown"
    },
    {
      "stage": "PICA",
      "lane": "PicaWorker",
      "start_ns": 23000000,
      "end_ns": 27000000,
      "token": "12",
      "source": "synthetic fixture",
      "source_role": "source_candidate"
    },
    {
      "stage": "Host Record",
      "lane": "RecordWorker",
      "start_ns": 27000000,
      "end_ns": 29000000,
      "token": "12",
      "source": "synthetic fixture",
      "source_role": "unknown"
    },
    {
      "stage": "FSR",
      "lane": "RecordWorker",
      "start_ns": 27300000,
      "end_ns": 28000000,
      "token": "12",
      "source": "synthetic fixture",
      "source_role": "unknown"
    },
    {
      "stage": "Guest",
      "lane": "EmuCore0",
      "start_ns": 30000000,
      "end_ns": 36000000,
      "token": "13",
      "source": "synthetic fixture",
      "source_role": "unknown"
    },
    {
      "stage": "Guest",
      "lane": "EmuCore1",
      "start_ns": 31000000,
      "end_ns": 35000000,
      "token": "13",
      "source": "synthetic fixture",
      "source_role": "unknown"
    },
    {
      "stage": "PICA",
      "lane": "PicaWorker",
      "start_ns": 33000000,
      "end_ns": 37000000,
      "token": "13",
      "source": "synthetic fixture",
      "source_role": "source_candidate"
    },
    {
      "stage": "Host Record",
      "lane": "RecordWorker",
      "start_ns": 37000000,
      "end_ns": 39000000,
      "token": "13",
      "source": "synthetic fixture",
      "source_role": "unknown"
    },
    {
      "stage": "FSR",
      "lane": "RecordWorker",
      "start_ns": 37300000,
      "end_ns": 38000000,
      "token": "13",
      "source": "synthetic fixture",
      "source_role": "unknown"
    },
    {
      "stage": "Guest",
      "lane": "EmuCore0",
      "start_ns": 40000000,
      "end_ns": 46000000,
      "token": "14",
      "source": "synthetic fixture",
      "source_role": "unknown"
    },
    {
      "stage": "Guest",
      "lane": "EmuCore1",
      "start_ns": 41000000,
      "end_ns": 45000000,
      "token": "14",
      "source": "synthetic fixture",
      "source_role": "unknown"
    },
    {
      "stage": "PICA",
      "lane": "PicaWorker",
      "start_ns": 43000000,
      "end_ns": 47000000,
      "token": "14",
      "source": "synthetic fixture",
      "source_role": "source_candidate"
    },
    {
      "stage": "Host Record",
      "lane": "RecordWorker",
      "start_ns": 47000000,
      "end_ns": 49000000,
      "token": "14",
      "source": "synthetic fixture",
      "source_role": "unknown"
    },
    {
      "stage": "FSR",
      "lane": "RecordWorker",
      "start_ns": 47300000,
      "end_ns": 48000000,
      "token": "14",
      "source": "synthetic fixture",
      "source_role": "unknown"
    },
    {
      "stage": "Guest",
      "lane": "EmuCore0",
      "start_ns": 50000000,
      "end_ns": 56000000,
      "token": "15",
      "source": "synthetic fixture",
      "source_role": "unknown"
    },
    {
      "stage": "Guest",
      "lane": "EmuCore1",
      "start_ns": 51000000,
      "end_ns": 55000000,
      "token": "15",
      "source": "synthetic fixture",
      "source_role": "unknown"
    },
    {
      "stage": "PICA",
      "lane": "PicaWorker",
      "start_ns": 53000000,
      "end_ns": 57000000,
      "token": "15",
      "source": "synthetic fixture",
      "source_role": "source_candidate"
    },
    {
      "stage": "Host Record",
      "lane": "RecordWorker",
      "start_ns": 57000000,
      "end_ns": 59000000,
      "token": "15",
      "source": "synthetic fixture",
      "source_role": "unknown"
    },
    {
      "stage": "FSR",
      "lane": "RecordWorker",
      "start_ns": 57300000,
      "end_ns": 58000000,
      "token": "15",
      "source": "synthetic fixture",
      "source_role": "unknown"
    }
  ]
}